가게명,요리,개업,운영상태,별점,리뷰수,리뷰1,리뷰2,리뷰3
생고기제작소 이수점,소고기구이,,영업 중,4.31,456,무한리필 소고기 이용했는데 고기가 너무 좋고 양도 많아요! 같이 먹은 육회랑 냉면도 너무 맛있었습니다,이수역에서 깨끗하고 맛있는 고깃집 원하신다면 여기루 가세요! 번창하세요! 또 방문하겠습니다,소한마리+스톤스테이크 세트 냉면까지 아이랑 셋이 먹었는데 배부르게 잘먹었어요!
오봉집 사당점,한식,,영업 중,4.52,426,매콤불맛 낙지볶음 맛있고 셀프바로 되어있어서 좋아요,보쌈과 낙지볶음을 같이 먹을수 있는 곳으로 정말 가성비 넘치면서 신박하게 어울리는 소주 안주의 조합인듯!,너무 맛있어요 이번에는낙지볶음 먹었지만 다음에는 보쌈먹어봐야겠어요
비엔나커피하우스 이수역점,카페,,영업 중,4.44,999+,위에 크림이 너무 맛있네요 부드럽고 쫀득한 크림이라 쌉사름한 커피와 너무 잘 어울려요,대형카페이지만 사람이 붐비지않아 좋아요. 대화나누기 좋고 커피도 맛있습니다!:),마들렌과 라떼 맛있게 먹었어요! 대화하기에도 좋은 장소에요:)
제비파스타&리조또방배사당점,"스파게티,파스타전문",,영업 중,,733,올때마다 정말 맛있게 먹는 것 같아요 스파게티 먹고 싶을때땐 제비파스타를 찾게 됩니당 ! 감사해요,이수역에서 가깝게 위치한 제비파스타! 알리오제비와 크림제비 먹었는데 양이 엄청 많아서 배부르게 먹었어요,가볍게 파스타 먹으러 와서 저렴한 가격과 엄청난 양에 놀라고 갑니다ㅎㅎ
코우엔,일식당,,오늘 휴무,4.94,121,"찹스테이크, 탄탄면, 나폴리탄 먹었습니다. 사장님이 음식에 정성을 기울이시는 게 느껴집니다.",서울 여행중 우연히 발견한 가게 와우 탄탄면 지대루네요 저녁에도 방문 해 봐야겠어요 ^^,리뷰 잘 안쓰는데 여기 찐자 메뉴마다 다 너무 맛있어요! 특히 탄탄면은 먹어본 탄탄면중에서 젤 맛있었어요
맥도날드 이수점,햄버거,,영업 중,4.15,999+,맥모닝으로 소시지 애그 맥그리들을 먹었어요. 맥머핀과는 다르게 핫케잌빵이라 더 달콤해요,소시지 에그 맥머핀 세트 2개 구입 (4800원x2=9600원) 언제 먹어도 참 맛있음.,가볍게 먹기 좋은곳 따뜻한 카푸치노가 있어 좋아요!
수연숯불갈비,한식,,영업 중,,133,그냥 와서드세요 이모님들 친절하게 고기도 잘구워주시네요 #파전서비스 #게장 #고기굿! #강추!,저는 아묻따 여기가 좋은이유는 요즘 이렇게 밑반찬 푸짐한집이없어요 저 파전이 서비스예요 ?,진짜 노포집 맛있는 갈비집 게장이 정말 맛있어요
BHC치킨 이수점,"치킨,닭강정",,영업 중,4.31,618,치킨 정말 맛있어요^^아이들 때문에 떡볶이도 덜 맵게 부탁드렸는데 아주 맛나게 만들어주셨습니다,사장님 너무 친절하셔서 좋았고 역시나 치킨은 맛있었습니다! 잘 먹고 잘 놀다 왔습니다,사장님 친절하고 치킨이 맛있게 나와요
돼지굴뚝,돼지고기구이,,영업 중,4.31,255,고기가 진짜 맛있어요 왜 다들 웨이팅하는지 알 것 같아요 가격도 저렴해요,고기 질도 좋고 구워줘서 좋아요,"드디어 가본 돼지굴뚝집! 소금구이랑 항정살, 껍데기 먹었는데 너무 맛있게 잘 먹었습니다. 그것도 꿀맛^^"
샤브로21 이수,샤브샤브,,영업 중,,252,"이수에 이런곳이 있다니, 1인 샤브라 혼밥, 입맛 달라도 다 맛있게 먹을 수 있어서 좋아요!",마라샤브에 빠져버렸어요 이수점이 제일 < 맛있어요,너무 너무 맛있어요! 고기도 많이 나오고 야채 구성도 알찼어요.직원분도 넘 친절하세요
오리촌,오리요리,,영업 중,4.22,361,"우렁쌈밥 잘먹고왔네요, 음식 맛있고 양도 넉넉하게 주셔서 좋았습니다.",쌈밥 맛있어요 우렁도 많이 들어있고 밑반찬도 깔끔하니 맛있어요,"9000원에 제육볶음, 된장찌개를 먹다니.! 풍족한 식사 맛있게 먹고가요 :)"
스코넬리 사당점,"카페,디저트",,영업 종료,,688,매번 맛있게 자주 사먹는 곳이에여 배달도 먹고 방문해서도 먹고 포장해서도 먹고!최애 스콘&버터바 카페에요,그동안 맛나게 냠냠 맛난 스콘 좋은 사람들에게 소개하고파서 또 샀네요.,스코넬리 최고 초코케이크 소식듣고 바로 픽업! 꾸덕한 크림 모에요 완전 초코러버픽이에요
이수가 원조,한식,,영업 중,4.28,286,홍어삼합 정말 맛있어요 그리고 해물김치전도 강추 강추-!,사장님도 친절하시고 홍어랑 보쌈 고기까지 너무 조합 최고예요 홍어삼합 인생맛집 조만간 또 먹으러 갈래요,닭볶음탕 맛있네요. 이수가 두군데 있는데 이집이 원조라고 하던데 국물 끝내줍니다.
동두천솥뚜껑삼겹살 이수역점,돼지고기구이,,영업 중,,333,동두천솥뚜껑삼겹살은 제가 정말 좋아하는곳인데 이수역점은 처음 와봤어요! 고기 두께도 두껍고 맛있습니다,삼겹한판 주문 했는데 완전 큰 고기 3개가! 양 진짜 많고 솥뚜껑에 구워서 더 맛있는거 같아요 ㅎㅎ,솥뚜껑 삼겹살 처음먹어보는데 좋아요 고기가 진짜 두툼하게 나와서 육즙을 가득 담고 있어요
봉빌렛,바(BAR),,영업 중,4.92,185,와 수제초콜릿 진짜 맛있어요. 먹어본 중 최고! 재방문의사 100프로,분위기도 좋고 날 좋은저녁 산책하다 한잔하기 좋은 술집이에요,아 칵테일 거의 1년 만이었는데 넘 맛있었어요
아기다람쥐,한식,,영업 중,4.22,405,영양솥밥이 맛있어요 누룽지도 맛있구요 깔끔하게 나오는 밑반찬도 좋아 여성분들 좋아하십니다,밥도 솥밥이고 반찬 국 다 맛있어요 여기 이런 밥집있는지 전혀 몰랐네요,동네 최고 밥집 전도 맛있고 고등어구이도 맛있음
본죽&비빔밥cafe 이수점,죽,,영업 중,4.09,999+,소고기 야채죽은 포장하고 냉이된장 제육비빔밥은 매장안에서 먹었어요,오랜만에 소불고기 비빔밥 주문했어요 맛있게 잘 먹었어요,아플때는 본죽이죠 소분되서 너무 좋아요 전복하나 낙지김치죽하나 해서 두개다
생마차 이수역점,이자카야,,영업 중,,247,맥주가격저렴해서 계속 주문하게 되었네요 재밌었어요,지나가다 닭날개 튀김 싸길래 혼술 했습니다 먹다가 소주 마시고 우동으로 마무리 했네요 혼술 하기 좋더라구요,일본식 선술집이고 간단하게 2차하기 좋은곳입니다
스시코에,"초밥,롤",,영업 중,,211,언제나 즐겁고 맛있는 스시코에 예약하기힘든만큼 좋은 시간보내고왔습니다,가성비가 정말 좋아요 이렇게 저렴하면서 양많고 맛있는 스시집은 처음입니다. 너무 맛있게 잘먹었습니다.,스시는 당연히 좋구 츠마미+솥밥도 맛있는 코에!
종로곱창,"곱창,막창,양",,영업 중,4.43,999+,이수역 시장 안에 있는 종로곱창 집입니다. 처음 생겼을 때부터 자주 가던 곳인데 잡내도 없고 맛납니다.,언제나 와도 정말 맛있고 양도 푸짐한 종로곱창 볶음밥 대박 맛있네요,양도 푸짐하고 맛있고 진짜 시장안 가성비 맛집이네요^^ 다음번에는 닭갈비먹으러 가겠습니다!
엔제리너스 이수역점,카페,,영업 중,4.35,999+,수빙수 이름이 너무 맘에드네요 ㅋㅋㅋ 올해 첫 빙수 맛있게 잘먹었어욤,스콘이 따듯하고 맛있어서 커피랑 잘어울려요 :),커피도 괜찮고 공간도 넓고 좋아요. 밤 늦게까지 하는것도 장점 같아요.
탕마루 생고기김치찌개 남성시장점,"찌개,전골",,영업 중,4.23,607,당신이 만약에 사당이수에 왔는데 시원 한 김치찌개와 푸짐 한 계란말이가 땡긴다면 여기여긴 반드시 와야합니다!,양이 엄청 푸짐해요! 삼겹살도 엄청 맛있는데 김치찌개도 맛있네요 삼겹살과 김치찌개는 여기서만 먹어요!,김치찌개가 먹고싶어서 검색해보고 갔는데 기대 이상으로 너무너무 맛있게 먹었어요! 강추입니닷
소문난집,"칼국수,만두",,오늘 휴무,4.31,928,"팥칼국수, 바지락수제비 맛있게 먹었어용 굿굿!",가게 이름만 보고 맛을 의심했는데 맛집 맞음 맛있음 칼국수 안땡겨서 수제비시켰는데 수제비도 충분히 맛있다,저렴한 가격의 시장 맛집입니다! 특히 서울에서 흔하지 않은 팥칼국수를 맛볼 수 있어서 너무 좋았어요!
루시케이크,케이크전문,,오늘 휴무,,34,,,
오끼 이수점,이자카야,,영업 중,,257,아 진짜 이집 정체가 뭐죠? 술집인줄 알았더니 본격 요리집이네요. ㅋㅎㅎ 음식이 너무 맛있어요.,하이볼 종류도 디게 많고 소주도 물론 맥주까지 판답니당 다음에 또 방문하겠습니다!,하이볼을 시켰더니 귀여운 토끼얼음이. 매장 분위기나 인테리어가 마치 일본여행 온 것 같은 착각.!
이수커피,카페,,영업 중,4.42,413,아이의 최애 음료 수박쥬스 올해 첫 개시 달콤하고 넘 맛나요,"그냥 운동끝나고 지나는길에 왓는데,아주 커피맛이 기분좋고 만족스러워, 올려봅니다.자주 들려야겟어요.",사장님께서 주문할때부터 넘 친절하셔서 기분 좋은 곳 아인슈페너도 잘 만드시네요
고슬미담,한식,,영업 중,,138,정갈하게 나온 한상차림도 굿 비빔밥 생각날때 다시 올 계획,한식파는곳 있어서 좋아요 청첩장 모임하기도 좋고 맛있었음!,"정갈하고 깔끔하고, 한식 비빔밥 맛집 오랜만에 방문해서 맛있게 먹었어요! :d"
충청삼겹 이수점,"육류,고기요리",,영업 중,,554,충청삼겹 소스삼겹 꼭 드세요! 간장계란밥 먹고 열무냉면 먹었는데 역시나 맛있었어용,충청도에는 삼겹살을 간장에 넣었다가 구워 먹는다고 들었어요.,이수 먹자골목 지나다니면서 한번 들려봐야지 하다가 드디어 왔네요 ㅎㅎ 소스 삼겹살이 무슨 느낌일까?
취향마라 이수역점,중식당,,영업 중,,999+,마라샹궈는 언제 먹어도 맛있고 꿔바로우도 너어어무 맛있어요!,지금까지 먹은 마라탕 중에 가성비 갑인 것 같아요!,"항상 마라탕에 꿔바로우 세트로 먹어요 미니부터 소, 대까지 고를수 있어서 좋아요"
용차이,중식당,,영업 중,,469,진짜 꿔바로우 맛집이에요!>< 소스가 딱 새콤달달하니 넘 맛있어요! 해물도 다양하게 들어가 있어요!,짬뽕은 칼칼하고 짜장은 역시 볶아서 맛있어요! 볶음밥 대박!,꿔바로우 좋아하시고 맛있는 꿔바로우 먹고 싶으시면 이 집으로 오세요 완전 꿔바로우 맛집이에요 감사합니다
이수치막,"치킨,닭강정",,영업 중,4.56,269,치킨과 막창을 세트로 먹을수있어서 술안주하기 좋아요,치킨이랑 막창이랑 같이 먹을 수 있어서 너무 좋았던 집. 그리고 중요한거건 완전 맛있어요.,화장실이 깨끗하고 선곡이 좋은 것만 해도 별 다섯개예요 분위기 좋구 막창 맛있었어요!
오블라디,요리주점,,영업 중,4.76,140,감성있는 lp파 노래들으면서 맥주마시기좋아요,맥주에 와인까지 다양해서 좋고 음악 있어서 좋아요 lp는 얼마 없는 것 같아요,사장님이 친절하고 lp음악 잘 들었습니다. 맥주도 맛있게 먹었어요
한가어죽 사당점,한식,,영업 중,,22,저희 집 어죽 맛집만 찾아다닐 정도로 어죽 진짜 좋아해요. 일주일에 한번씩 오고있어요,"사장님 부부 완전 친절! 민물새우,메기,잡고기 매운탕 3종 때리고 단체 모임하고 옴!",사장님 친절하시고 멸치회무침이 특히 맛있어요 도리뱅뱅이도 먹어보고 싶어요 재방문의사 있습니다
양계장집아들 방배본점,"치킨,닭강정",,영업 중,4.38,478,가끔 생각나는 옛날통닭 맛집입니다. 튀겨서 바로 먹으면 바삭바삭 진짜 맛있어요.,갓 튀긴 치킨은 못참지!^^ 매장에서 먹는게 무조건 맛있습니다! 문어튀김. 쥐포튀김도 강추!,방배동 맛집입니다. 치킨도 다른곳보다 저렴합니다.
토리아에즈 이수점,이자카야,,영업 중,,131,이수역 오거리에 바로 있고 혼술 하기 너무 좋습니다. 맥주 이자카야로는 최고라고 생각합니다.,술맛있었는데 꼬치가 한꺼번에 안나오고 하나씩 나옴.,달달하고 상콤한 하이볼에 가성비 좋은 꼬치까지! 꼬치 원하는대로 골라서 수량 제한없이 시킬수있어서 좋아요
카츠공방 내방역점,돈가스,,영업 중,,999+,마제소바랑 모듬카츠 먹었습니다. 삿포로맥주에 돈카츠 조합 참 좋아요. 약간 매콤합니다.,튀김이 맛있고 전반적으로 맛이 깔끔해서 좋아요! 부모님과 간단하게 점심 먹기 좋아요,카츠공방 너무 맛있습니다! 시그니처메뉴도 맛있고 치즈카츠도 최고입니다 양도 굉장히 푸짐하고요
요굿트,"카페,디저트",,오늘 휴무,,182,바닐라 그릭요거트 비요뜨를 압축시켜 놓은 맛이랄까요 산미 없고 맛있어요!,꿀 뿌려 먹으니까 더 맛도리. 요즘 최애 요거트 집이에요,요거트 맛도 다양하고 매장도 깔끔해서 너무 좋아요 쿠폰도 있으니 자주 와서 도장 찍어야 되겠어요
강원도감자옹심이,한식,,영업 중,4.09,378,보리밥은 기본으로 나옵니다 옹심이는 씹을수록 고소하고 맛있어요 칼국수는 감칠맛이 좋아요,옹심이 뿐 아니라 함박스테이크 숙주.계란후라이에 소스가 밥과 같이 너무너무 맛나게 잘 어울려요,옹심이 감자가 맛있다고 해서 갔는데 우리 동네 옹심이 칼국수가 더 맛있어요
버거앤프라이즈 이수역점,햄버거,,영업 중,4.39,331,"햄버거빵 부드럽고 폭신하니 쫄깃하고요 새우패티,소고기패티 넘 맛났어요.",깔끔하고 건강한 수제버거 맛입니다 가끔 오는데 늘 만족합니다,와 수제버거 맛집입니다 진짜 너무너무 맛있었요ㅋㅋㅋ 불고기버거에 통살새우패티 추가해서 먹었는데 대박ㅋㅋㅋㅋ
공평동꼼장어 이수점,"장어,먹장어요리",,영업 중,,,2번째방문 사장님 친절해용 근데 직원이1명이라 너무너무 바빠유 김치칼국수 도시락 굿,"꼼장어 1인분 13,000원 맛있고, 친절해요.",초딩 아이들이 있어서 기대없이 돼지왕갈비를 시켰는데.왕갈비 숨은 맛집이었음!
낭만짚불구이 이수역점,요리주점,,영업 중,,104,이수역 데이트하기좋은 술집 . 트러플 감자전에 반해서 종종 오고있어요.,대통주 새로같은 느낌나네욥 너무 쓰지 않고 맛있어요 짚불 불닭구이 딱 불닭볶음면 정도의 맵기입니당 추천,사장님도 너무 친절하시고 들깨 수제비 진짜 고소해서 맛있습니다 안주도 가성비최고 또 방문할게요
파리바게뜨 이수태평점,베이커리,,영업 중,4.33,999+,케익 픽업했습니다. 항상 변함없는 맛입니다!:),꾸미기케익 좋네요!ㅎㅎ 크림이 느끼하지않고 맛있습니다,"모카빵,옥수수식빵 맛나게먹었어요"
곽반장,중식당,,오늘 휴무,4.41,999+,쉬는 주말에 종종 찾는 짬뽕맛집. 내입맛에는 너무 맵거나 자극적이지않고 무난해서 좋은맛,짜장면이랑 짬봉이 진짜 맛있는데 탕수육은 더 맛있어서 가는 곳 입니다 ㅎㅎ,짬뽕에 낮술 반주하기 좋아요. 만두 가격이 천원 올라 서운하지만 그래도 아직 열개 나와 양은 그대로그대로구요.
지구커피,카페,,영업 중,,538,커피 맛있다는 리뷰들이 꽤있길래 왔습니다. 인정합니다 고소하니 넘 맛있게 먹었습니다^^,이수역 골목에 위치한 작은 카페입니다 쿠키도 맛있고 음료도 다 너무 맛있습니다 !,저 크키 진짜 맛있게 먹었구요 커피도 맛있었어요 가까우면 자주갈테텐데
참치아도로 이수본점,생선회,새로오픈,영업 중,,,매장이 깨끗하고 사징님이 친절합니다 참치회를 많이 먹어보진 않았지만 거부감없이 맛있게 잘 먹었습니다,참다랑어인데 이가격에 이퀄리티로 먹을수있다는게 너무 좋았습니다 잘먹고 갑니다^^,
어부의딸,한식,,영업 중,4.48,250,제철맞은 산쭈꾸미구이랑 샤브 고소하고 맛있어여! 같이나온 마늘쫑은 꼭 구워드셔보세요!,제철인 쭈꾸미 먹으러 다녀왔습니다. 신선하고 정말 맛있었어요! 구이도 샤브도 모두 추천!,서울에서 먹기 힘든 산쭈꾸미랑 산꼼장어 먹을 수 있어요. 산쭈꾸미샤브도 있음.
쌈이랑고기랑 쌈밥,쌈밥,,영업 중,4.33,377,바싹불고기같고 쌈 종류는 많지는 않은데 반찬이나 밥 된장찌개 다 집밥같이 맛있음,오늘은 대패삼겹먹었는데 맛있어서 많이 먹었습니다. 맛과 친절에 대한 보답으로 싹비우고 정리해봤네요,오늘의 밥상은 황태탕 정식 :9 맛있고 따끈하게 잘 먹었습니다!
미얏베이커리,베이커리,,영업 중,,57,이름부터 귀염뽀짝한 곳 무화과 깜빠뉴 맛있어요,고양이를 좋아하신다는 사장님 그래서 가게이름도 미얏베이커리라고 합니다,집앞에 소금빵 맛집이 생겼네요-! 소금빵 존맛입니다 꼭먹어보세요!
인생극장쪽갈비 이수점,돼지고기구이,,영업 중,,430,요기집은 완전 감성 지대루에 반찬들 알차구 (백김치 ㄹㅇ 완전 맛남. 쪽갈비랑 꼭 같이 시킵시다!,인생극장쪽갈비이수점 소금구이쪽갈비/양념쪽갈비 뜯어서 먹는 맛이 제대로인 쪽갈비!,쪽갈비 오랜만에 먹는데 뼈랑 살이 잘 불리되서 먹기 편하더라구요 ㅎㅎ
이수살롱,"카페,디저트",,영업 중,4.66,264,"당일에 디저트를 아무것도 먹을 수 없어서 아쉬웠지만, 샹그리아 레드 정말 맛있게 먹었습니다.",할로윈 분위기 흠뻑이네요 ^-^ 음악 분위기도 너무좋고 커피도 맛있어요.,브런치가 예약이엿따니! 그래도 쿠키맛낫어용 헤헤
옹기종기식당,한식,,영업 중,,45,,,
제이앤제이바,바(BAR),,영업 전,,513,이수술집 중에 이런 가성비 좋고 분위기 좋은 바가 있다니! 칵테일도 위스키도 너무 맛있었어요,이수역에서 가볍게 2차로 한잔 하고싶어서 가게 되었어요 같이 먹었던 애플모히토 칵테일도 너무 맛있었어요!,칵테일맛이 다 좋아요 사장님도 친절하시구요:)
시스트로,양식,,영업 중,4.27,184,"이전 리뷰에서 유명한 앉은뱅이 리조또(토마토), 바칼라, 가지볼로네제 먹었습니다 추천",리조또 두그릇은 첫경험 ㅋ 둘다 만족 ^^ 아마트리치아나도 좋은데 좀더 매콤해두 더 좋을것 같네요,와인 모임히기 좋은 이수역 이탈리안 레스토랑이에요 와인 한잔하며 식사하기 좋습니당!
양모리,"곱창,막창,양",,영업 중,4.31,264,방배 양고기 맛집! 가격은 좀 비싼편이지만 정갈하고 사장님이 친절하셔요!양볶음밥 맛있고 고기도 맛나요,내방역 가까이 있는 맛집 양모리! 양모리에서 특양구이를 먹었는데 계란찜과 밑반찬이 모두모두 맛있었어요.,양대창은 앞으로 양모리입니다. 진짜 부드럽고 쫄깃하구 미쳤어요
타코익스프레스,"멕시코,남미음식",,영업 중,,47,1. 하드타코 개마시씀 2. 채식타코 대박임 고기 보다 더 고기고기함 3. 숨겨진 하이볼 맛집임,가성비 타코 맛집인데 와 맛있다보단 가격 대비 만족스럽다 정도의 타코입니다.,"조금 이른 점심으로 돼지고기 부리또에 감자튀김과 살사, 고수 추가해서 먹었습니다!"
이삭토스트 이수역점,토스트,,영업 중,4.58,842,토스트 너무너무 맛있고 사장님이 너무너무 친절하셔서 아침부터 기분 좋은 하루를 시작할 수 있었어요,프렌치토스트 맛있어요! 포슬포슬 업그레이드 되어서 너무 좋아요,진짜 여기 사장님 세상에서 제일 친절하심. 이삭토스트 항상 맛있게 잘 먹구 있습니당 ㅎㅎ
단미,"카페,디저트",,영업 중,4.67,161,분위기 너무 좋고 마카롱 가격도 착해서 좋아요! 이런 골목에 귀여운 마카롱 집이 있어서 너무 좋아요,쫀득쫀득맛있어요 마카롱 투어투어라고해야하나?^^ 찐한맛이 일품이네요 말차 추천합니다^^,진짜 정말 맛있어요 다음에도 꼭 방문 할려구요 특히 크림브륄레 맛있어요 ㅎㅎ 화이트데이 세트도 너무 이뻐요
스타벅스 이수역사거리점,카페,,영업 중,4.43,999+,커피한잔 마시고 창밖바람도 적당이불고.일하느라쌓인 피로가 너무기분업 시켜주네요.,카페라떼에서 우유를 오트(+600)로 바꾸니 더 맛있어지네요 스벅을 이용하는 새로운 방법을 터득했습니다,스타벅스 꾸덕한 그릭요거트에 바삭한 그래놀라 넣어 먹으니 맛있어요. 점심식사로 샌드위치도 좋네요.
할리스커피 이수역점,카페,,영업 중,4.16,999+,망고빙수 맛있어요! 가게도 시원하고 좋았어요:),크로크무슈 따뜻하니깐 맛있어요 아라맛도 적당히 진해서 맛있네요,맛있네요 투썸이랑 다르게 빵부분이 많아 더 케이크같은 느낌!
라밥이수2호점,종합분식,,24시간 영업,,999+,맛있게 잘 먹었습니다 :) 식사량이 많이 줄었는데 미니김밥 메뉴가 있어서 너무너무 좋아요. 그리고 사장님?,뚝배기떡볶이가 진짜 맛있었고 김밥은 묵은지참치김밥이 정말 최고엿어요,루꼴라김밥 괜찮아요 늦은시간까지 여는게 좋아요
반,소고기구이,,영업 중,4.5,352,야채무침 백김치 샐러리장아찌와 고기가 깔끔하게 맛있고 새우젓도 맛있습니다.,이베리코 신선하고 육즙 많아서 맛있어요ㅋㅋ조용하고 분위기 좋은 고깃집이에요 이수역맛집으로 추천!,이베리코 돼지고기 먹었는데 잡냄새없고 존맛이네요
시선 이수역점,이자카야,,영업 중,,289,소고기 스키야키 너무 맛있어요! 안주도 맛있고 가성비 좋은 힙한 이자카야예요.,사시미 모듬꼬치 모두 너무 맛있어요 ㅎㅎ ! 술이랑 찰떡궁합이에요 술집 찾으신다면 시선으로,우와 꼬치가 어떻게 이렇게 맛있을수 있나요 이수역에서 제일 괜찮은 이자카야입니다
꿀돈,"육류,고기요리",,영업 중,,286,남자친구랑 오랜만에 고기먹으려고 방문했어요 ! 매장 깔끔해서 분위기 좋구 고기가 질이 정말 좋네요 ㅎㅎ,이수역 고기집 꿀돈! 고기질 넘넘 좋구요 목살 진짜 맛있습니다,이수/방배의 신선한 돼지고기집을 찾으신다면 이곳을 강추드립니다. 재방문 의사 200% 있어요!
오빠화이팅 이수점,이자카야,,영업 중,,133,그리고 닭껍질튀김하고 홍콩식오이무침 조합 최고예요 ! 완전 둘이 결혼(?)한 조합이에요ㅋㅋㅋㅋㅎㅎ,저렴하지만 맛있는 안주. 은행. 마늘구이. 염통. 닭목살. 모래집 진짜 맛있어요,생맥주 맛있어요 꼬치구이도 맛있고 운좋게 먹은 수제치즈두부도 맛있고 홍콩식 오이무침도 맛있고 다 맛있어용
갯벌의 조개 이수점,조개요리,,영업 중,,507,갔더니 여름 이벤트로 무료 사이즈업과 닭백숙도 서비스로 넣어준다고 하시더라구요!?ㅎㅎ,이사온지 얼마 안됐는데 와이프가 조개전골 먹고싶다고 해서 검색해서 왔는데 너무 맛있어요,대왕조개전골이랑 사이드 메뉴들 먹었는데 정말 다 맛있고 양도 푸짐하고 해산물 종류도 다양해서 좋았어요
샐러드식당 사당점,"다이어트,샐러드",,영업 중,,240,점심에 혼밥하기 좋아요 샐러드 양을 많이 줘요,닭가슴살 샐러드 먹었습니다. 가격만큼 양이 많았어요! 식단 하시는 분들께 추천합니다!,봄에 생긴 새로운 동네 샐러드집! 오미자차도 달달상큼해서 같이 먹기 좋네요.
왓츠플레이버,햄버거,,영업 중,,381,여기오레오쉐이크넘맛있어요 감기걸려도 무조건 먹게되는맛 .,클래식버거 너모 맛있어요! 빵부터가 담백하니 맛있고 재료들이 신선합니다 패티 퀄리티도 굿굿,뿌듯 사진은 클래식이 작아보였는데 절대아님! 따수운 직원분과 사장님 친절합니댜 수제버거 쨩
인쌩맥주 이수역점,"맥주,호프",,영업 중,,578,혼술하기에도 좋아요. 홍차주랑 김치우동 맛있었어요!,"생맥주 외에도 자몽, 블루베리, 벌꿀 맥주가 있어 좋네요. 과일 안주가 가격대비 잘 나오는 느낌입니다.",2차로 갔는데 살얼음맥주와 떡뽁이 너무 맛있어요!
