가게명,요리,개업,운영상태,별점,리뷰수,리뷰1,리뷰2,리뷰3
미고삼,"육류,고기요리",,영업 중,4.45,594,"고사리, 미나리가 고기랑 환상궁합 실컷 먹고왔어요.",맛있게 잘 먹었습니다 고기 상태가 상당히 좋아보였고 여러 반찬들과 함께 먹으니 배로 맛있었어요,또또또 재방문ㅎㅎ 고기는 항상 이집만와요 구성도알차고 질이 번창하세용
땡초우동 이수본점,"우동,소바",,영업 중,4.46,625,2차나 3차로 가기 딱 좋은 곳 땡초우동 꿀토마토 소떡소떡,우동이 얼큰하니 술안주로 딱이예요. 가성비도 좋아서 1차로도 2차로도 굿굿.,우동은 예술이고 땡초세트메뉴 추천합니다. 고기안주 완전 맛있고 소주가 술술 넘어가네요 추천 드려요
더풍년 이수점,"해물,생선요리",,영업 중,4.65,276,"우리동네 맛집! 매번 오지만 너무 맛있고, 신선하고 분위기 좋아요 해물파전 꼭 먹어요!",완전 맛있어요 숙성회 너무 좋아하는데 탑티어에요 밥도 간이 잘되어서 초밥만들어먹기딱이에오,모둠숙성회 구성넘좋고맛있어요비빔면도맛있고 다른음식들도맛있어요 추천입니다
퍼시브 커피,"카페,디저트",,영업 중,,362,커피맛이 야무져요. 커피맛집. 신거 꼬소한거 고를 수 있어서 좋음. 직원분들 인상도 좋고 친절함. 굿.,아메리카노도 맛있고 특히 애플시나몬티가 정말 맛있어요 오늘은 밀크티 시켰는데 밀크티도 맛있어요,디카페인 라떼와 브라질 핸드드립 마셨어요 둘 다 맛있었어요
산쪼메 이수점,일본식라면,,영업 중,4.4,817,산쪼메라면과 가라아게 먹었는데 라멘 육수가 진하고 맛있어요 가라아게도 바삭하고 따뜻하고 정말 맛있어요.,이수역 올때마다 산쪼메는 꼭 들러요 가라아게랑 교자도 진짜 맛있어요 강추합니다,라멘이랑 미니 덮밥 먹을 수 있는 세트 메뉴가 있어서 시켜서 먹었어요 쇼유라멘 깔끔하게 맛있더라고요!
쟝블랑제리 이수직영점,베이커리,,영업 중,4.41,999+,새해케이크는 장블랑제리에서 생크림 맛있어요^^,쟝블랑제리에서는 맘모스빵이 제일 가성비 좋은 듯,저녁 7시 30분 타임 맘모스빵 구매하려고 30분 전부터 대기 탔습니다 한 번쯤 꼭 가볼만 합니다
치키차카초코 사당이수점,"카페,디저트",,영업 중,,842,"코르네파이 세트 주문했는데 오리지널, 초코, 커스터드, 그린티, 딸기요거트 5가지 맛으로 구성되어 있어요!","냉동실에 쟁여두고 아이스아메리카노와 함께 먹으니 꿀조합입니다 코르네파이는 새로웠는데요,",정말 달달하고 바삭한 엄마손파이에 크림이 양껏 들어간 디저트에요!
공돈,"육류,고기요리",,영업 중,,724,"너무 맛있어서 재방문했어요 :) 고기 질은 물론이고 기본 밑반찬, 냉면 하나하나에 진심이 들어가있어요 ㅎㅎ",고기 질이 넘 좋고 넘 맛있어요! 반찬도 넘 깔끔하게 잘 나오고 샐러드가 존맛이라 3번 먹었네요 ㅎㅎ,매일 지나가기만 하다가 새로 생긴 고기집같아서 방문했어요! 담에 칭구랑 또 방문 예정입니다
정원분식,종합분식,,영업 중,4.37,999+,유튜버 쯔양의 분식집! 음식도 맛있고 매장도 넓어서 좋았어요,짬뽕떡볶이 먹으려다 곱창대창떡볶이로 바꿨는데 잘한 선택이었어요! 배부르다하면서도 둘이서 싹 비웠네요.,곱대창 떡볶이 소스 맛있고 로제도 무난해요 한번쯤 가볼만한 곳 두번은 글쎄요
조선부뚜막 이수역점,"육류,고기요리",,영업 중,,999+,야채많이 먹고 찌개도 먹고. 공기밥도 나와서 식사맛집이네요. 다음엔 목살이나 삼겹구이를 먹어야겠어요,조선부뚜막집 맛집 인정입니다^^삼겹살에 목살에 한우차돌박이에 껍데기 넘 맛있어요^^,고기집인데도 매장이청결하고 위생좋아보여요 목살이랑 냉면 너무맛있게 잘먹었어요!
힛지,요리주점,,영업 중,,182,이수역 술집 힛지에서 먹은 토마토해물스튜(파스타) 맛있습니다 각종 해산물이 듬뿍 들어가서 더욱 맛있내요,아는 단골은 늘 오늘 짱좋은 이수역 술집!ㅎㅎ나만알고픈곳이지만 우삼겹쫄면 못참지 힛지 시그니처임:),이수역에 오면 항상 오는 술집입니다! 음식이 맛있고 술종류가 다양해요 안주가 맛있습니다
고멘,일본식라면,,영업 중,,259,또 신메뉴가 나왔다고해서 방문했습니다! 신메뉴인 비빔 탄탄멘은 약간 마라탕이 생각나는 맛이에요!,고기가 정말 맛있는 라멘이네요 잡내 1도 안나고 엄청 부드럽더라구요. 별미였습니다.,깔끔하고 맛있는 소유라멘입니다. 면도 맛있고 토핑도 종류가 여러가지라서 더 맛있게 먹었습니다.
단아한정식,한정식,,영업 중,,401,맑은 탕은 해장 생각나는 시원함! 밥을 푸고 남은 돌솥에 물 부어 만든 숭늉도 먹어줍니당!,점심특선 먹었어요 항상 먹을때마다 만족스러워요 음식 깔끔 저갈해요 한식생각날때 오는곳이에요,기본반찬도 너무맛나맛나고 보리굴비 최고메요
스시세이,"초밥,롤",,영업 중,4.6,541,전복죽.샐러드.초밥.우동.아이스크림까지 모두 맛있네요.깔끔하고 분위기도 좋았어요.,죽. 우동. 연두부 튀김이 나오고 초밥도 맛나서 좋아요 가성비 좋습니다-!,평점이 좋아서 한번 먹어봤는데 그 이후로 초밥은 여기서만 먹어요 vip초밥 추천합니다.
슬로우캘리 사당이수점,"다이어트,샐러드",,영업 중,4.61,999+,여름에 입맛 없을때 제일 생각나는 포케에요 매콤하면서도 상큼한 맛이라 언제 먹어도 맛있어요,건강한 맛! 가격대는 참치 11.5 연어 12.5 포케 정도예요.,슬캘 자주먹는데 건강식으로 너무 좋아요 배고팠는데 든든하고 건강하게 식사할 수 있어서 좋았습니다.
야끼니꾸 소량 이수점,"육류,고기요리",,영업 중,,999+,여러가지 고기를 조금씩 골라 먹을수 있어서 너무 좋아요 맛도 있고 분위기도 좋아요 재방문의사 있어요,맛없는고 하나 없는 야끼니꾸집 고기 다양하게 나와서 골라먹는 재미에 하이볼도 저렴해서 완전 좋앗어용,동네 2n년차 살았는데 신박한 맛집 생겨서 너무 좋아요! 이수역 야끼니꾸+기린 생맥주 맛집이라니!
고추찜닭 본점,찜닭,,오늘 휴무,4.35,752,이수에서 찜닭 단일메뉴로 오래된 곳이에요. 노부부가 운영하시는데 느리셔도 친절하세요. 건강하세요 사장님,닭한마리 둘이먹기엔 양이많아요. 사리추가없이도 둘이먹기엔 충분한양이네요. 맛있어요.,친절하고 맛있어요 중간맛이지만 적당하게 매콤하고 좋아요 오래된 찜닭 맛집.
이수면가,"칼국수,만두",,영업 중,4.32,494,초계국수 맛있어요 일반 냉면용 면이 아니고 부드러운 면이라 속도 편해요,비오는날 해물칼국수만두전골 맛있게 잘 먹었습니다.많이 짜지 않고 만두도 맛있네요.,왕만두가 4개들어가고 보리밥도 나오고 칼국수까지 알찬 구성으로 잘 먹었습니다. 맛도 깔끔하고 맛있어요.
키친아일랜드 사당방배 본점,돈가스,,영업 중,,516,아이들과 함께 키친아일랜드에서 저녁식사 하였습니다. 등심돈까스 바삭하니 고기 부드러워요.,이수역 돈까스 맛집으로 유명하길래 돈까스 매니아 남자친구랑 다녀왔어요,"40대 남자 3명이서 등심돈까스, 새우로제파스타, 리에또를 먹었는데. 음식이 맛있고 양까지 많았어요."
이수쭈꾸미 본점,주꾸미요리,,영업 중,,671,친구들 추천으로 연말 모임 겸 오게됐는데 볶음밥까지 너무 맛있게 잘 먹었습니당! 다음에 또 올게요 :),쭈삼 추천! 적당히 매콤하고 고기랑 쭈꾸미 조합이 좋아요 나중에 볶음밥까지 더하면 완벽!,쭈꾸미 삼겹살 먹었는데 쫄깃하고 맛있어요. 매운맛도 조절되서 좋아요
스타벅스 이수역점,카페,,영업 중,4.47,999+,커피는 늘 맛있어서 이번에는 초콜렛을 사보았어요 다크와 밀크 두 종류가 있더라구요 ^^,"1+1 행사 디카페인 플랫화이트 , 돌체라테 마셨습니다 플랫화이트 아주 맛있어요",최애 더 촉촉 초콜릿 생크림 케이크입니다 스테디셀러엔 이유가 있죠 초코덕후는 초코시트라 행복해요
찰리 앤 몰리,"카페,디저트",,영업 중,,281,귀여운 매장 분위기에 반하고 베이글 맛에 한번 더 반했어용!,부추베이글 향이 향긋해서 깜짝놀랐어요! 크림도 너무 신선한느낌이네요,제 인생 베이글 맛집입니당! 친절하게 대해주시고 그만큼 맛도 너무 맛있어요! 자주올서예용
이수짜장,중식당,,영업 중,4.39,343,삼선짜장면 양도 많고 고기.새우.양파 풍성하게 들어있어서 끝까지 맛있어요.,쟁반짜장 양이 엄청 많아요 옛날 짜장면 좋아하는 분이라면 여기 무조건 강추! 짬뽕도 정말 맛있어요,이수역 남성시장 안에 있는 중국집으로 가성비 좋은 짜장면을 드실 수 있습니다 볶음밥도 맛있습니다
마로,한식,새로오픈,영업 중,,,새로생겼다길래 친오빠랑 술한잔 하러 다녀왔습니다. 백된장회무침도 너무 맛있었구요,"이수역 맛집을 찾았음에 감사를, 조만간 또 재방문할게요 . . 이수역 술집 은 앞으로 마로로 정착",이수에 새로 생긴 술집을 발견해서 다녀왔는데 여기 조용히 술 한잔하기 좋고 데이트 장소로 추천해요.
분분 이수역점,베트남음식,,영업 중,,608,오늘은 반미먹으러 왔습니다. 국수도 덮밥도 모두 맛있습니다 추천해요!,여기 너무 맛있어서 재재재재재방문이에요 항상 맛 변하지않고 분짜랑 반미랑 완전 강추맛있어요,"오늘도 맛있게 먹고 갑니다. 신메뉴 버팔로윙 나와서 먹어봤는데, 간이 딱 맞아요. 추천합니다."
사이,"카페,디저트",,영업 중,4.59,458,사이라떼랑 크로플 진짜맛있어요! 디카페인도 변경되서 좋았어요 ㅎㅎ,혼자 방문 해서 테이크 아웃 했지만 기회되면 버터스카치라떼도 먹어보려고요,디져트도 맛있고 음료도 맛있어요! 약과쿠키 최애등극 추천이에요ㅎㅎ
롯데리아 이수역점,햄버거,,24시간 영업,4.27,999+,급할 때 햄버거가 편하죠! 간만에 먹으니 만족도 굿입니다!,햄버거 집에포장해서가지고와서 양상추 더넣어먹으면 짱맛,언니랑 따뜻한 캐모마일 티 한잔하면서 긴대화를나눠서 좋았어요 ^^
라미스콘 방배점,"카페,디저트",,영업 중,,131,스콘은 못먹어봤지만 치즈수플레 먹어봤는데 맛있었어요.,오랜만에 방문한 라미스콘! 못 보던 메뉴도 많이 생겼더라구요,"스콘맛집이라고 들었는데, 여기 레몬치크케이크도 훌륭하네요 수플레도 많이들 드시더라구요."
알코홀릭드링크 서울이수점,양식,,영업 중,,167,술 종류도 다양한데 평소 궁금했던 위스키를 저렴하게 구할수 있어서 좋았어요!,데일리샷으로 술 사러 왔어요 위스키가 저렴하길래 간 김에 2병이나 더 샀아요 ㅋㅋ,
군선생 이수점,요리주점,,영업 중,,,술집만 하시는 거걸로 알다가 지나가다 보니 점심 메뉴도 시작하셔서 바로 방문했습니다,예전엔 숯불로생선구엇는데 지금은화덕으로 생선을 굽네요 전보다 훨씬부드럽고 반찬도 깔끔하고 조아요,사진찍은줄 알았는데 없네요; 매콤떡볶이 먹었는데 적당히 맵고 너무 맛있었어요. 또 방문할꺼에요
삼백돈 돈가츠 이수점,돈가스,,영업 중,4.46,999+,고기가 부드럽고 돈가스 소스 맛있어요. 카레와 우동도 시켰는데 맛있어요!,항상 맛있게 먹고 있습니다. 여름이라 소바가 더 맛있네요.,돈카츠 좋아해서 찾아보다 방문했는데 구성도 너무 좋고 완전 제 스타일이에요 앞으로 종종 방문하려구요 ㅎㅎ
돌담,바(BAR),,영업 중,4.84,342,제가 방문했던 칵테일 무한리필집 중 최고인 것 같아요! 중간에 마술도 보여 주셔서 신선했습니다,"칵테일 무한리필로 했을 때도, 술이 나올 때마다 예쁘게 나옵니다! 화장실도 깔끔합니다!",분위기 좋은 칵테일바! 다양한 연령층이 찾는 정말 마음에 쏙 드는 장소를 발견했어요!
유미카츠 이수방배점,돈가스,,영업 중,,999+,지나가기만 하다 돈가스 생각나 들러봤어요 ㅎ 무난하고 맛있어요. 밥도 많이 주시고 추가 반찬.,오늘은 쫄면을 처음시켰는대 역시나 맛나게 먹었어요^^,"떡볶이도 좋아하고, 돈까스도 진짜 좋아하는데 두메뉴를 다 먹을 수 있어서 진짜 좋았어요!"
신전떡볶이 방배점,분식,,영업 중,4.52,999+,마라로제 첫도전이었는데 국물에 튀김과 순대 찍어먹으니 맛도리네요,매운떡볶이중에 신전떡볶이가 제일 맛있어요 ! 치즈떡볶이는 처음 먹어봤는데 맛있네용!,신전떡볶이 너무 맛있어요 오징어튀김도 꼭 먹어요 굵은 당면 넣어서 먹으면 더 좋아요
방배동개성집,한식,,영업 종료,4.46,471,건강한 만두국맛이예요. 국물이 진하고 맛있어요,냉면도 맛있고. 떡국 찜만두도 기절이고. 여기 넘사벽 맛집,방배동에서 최고로다가 맛진 만두국 집이 아닐까해요. 갈때마다 만원의 행복 느끼고와요
봉평메밀마당 이수역점,막국수,,영업 중,4.4,522,메밀막국수와 매생이굴국밥 먹었고 만두까지. 맛나요! 깔끔해요,생굴 육개장 생굴 육칼 맛있어요! 다른 메뉴도 맛있어요,시원하게 모밀맛있었어요 양도많고요
산골짜기다람쥐,한식,,영업 중,4.36,576,임자탕과 도토리묵무침이 유명한 곳이라서 자주 갔던 맛집인데 한방보쌈까지 맛있네요.,보쌈 정식 너무 맛있어요 ! 한 끼 뚝딱해서 먹었습니다,진짜 너무 맛잇어여! 무말랭이무침이랑 같이 먹으면 꿀맛 맥주 말고 막걸리에 먹을걸
부엉이산장 이수점,요리주점,,영업 중,,191,"육새전(소고기+새우) 20,000원 고추장육회 24,000원 묵사발7,000원 새우전이 크고 맛있어요",닭볶음탕 진짜 너무 맛있어서 또 왔어요 비법 궁금할 정도로 쫀맛! 테이블 사이가 넓어서 편했어요,곱도리탕 먹으러 왔는데 새로보이는 메뉴가 보여서 냅다 시켰음 불오징어? 제발 볶음밥까지드세요
위안,요리주점,,영업 중,,230,손 많이 가는 수육전골을 푸짐하고 맛나게 먹었습니다. 친구들과 종종 가게 될 것 같습니다.,수육 최고예요 고기가 정말 맛있어요! 수육 전문점이라고 해도 될정도,수역전골 대박 맛있어요! 고기 너무 부드럽고 양도 넉넉 너무 좋았어요
썸머스테어,"카페,디저트",,영업 중,,718,검색해서 우연히 방문했는데 조용하고 아늑한 공간이에요! 커피랑 케익도 맛있어서 배부른데도 맛있게 먹었습니다,바닐라라떼. 썸머에이드. 썸머슈페너. 키위케이크랑 라즈베리케이크 먹었습니다:) 다 너무너무 맛있게먹었어용,"이수역에 이렇게 예쁘게 포장해주는 디저트가게가 있더라구요,? 자주 이용하겠습니다! 감사합니다!"
시로미,일식당,,영업 중,,70,부타동 고기도 많고 맛있습니다.창문 너머 보이는 놀이터의 나무들이 초록초록 예쁘네요.,동네 산책 중에 지인들과 부타동 매력에 이끌려 들어갔어요 깔끔한 인테리어에 무난하게 맛있는 식사였습니다.,카레 우동 진짜 자극적이지 않고 너무 향긋하고 맛있어요!면발도 불지 않고 탱글한게 맛있습니다 ㅎㅎ
남산터 이수점,"찌개,전골",,24시간 영업,,999+,"부대찌개종류도많고,양도많아요.약간 매운듯했지만 초등아이가 못먹을정도는 아니예요.",해장하려고 먹었는데 맛있어요! 햄도 많고 고기도 많음 약간 김치찌개와 부대찌개 중간의 맛?,양도많고 맛있어요 곱창 추가했어요!ㅋㅋ ㅋ서비스 오믈렛도 굳
3공간 사당,와인,,영업 중,4.22,207,여기 토마토 아라비아따 파스타 맛집입니다. 밖에서 와인 1병 이상 안마시는데 2병 마신 곳이에요.,카페 같기도 하고 분위기 좋은 와인 레스토랑 같기도 하고 브라이덜샤워나 생일파티룸으로도 좋아보입니다ㅋㅋ,특별한날 특별한 제3공간 너무 좋네요! 인생사진 건지고 맛난 와인에 특별했던 감바스까지!
싱싱오동도산아나고꼼장어숯불구이,"해물,생선요리",,영업 중,4.42,319,"소갈비살,오돌뼈 잔치국수 다 맛있어요 브레이크타임이 없어서 편하게 이용했네요",야장네서먹었아요 아나고 맛나네요,아나고회 너무 먹고 싶어서 갔는데 여기여긴 구이맛집인거 같았어요 다들 구이를 드시더라구요 ㅋㅋㅋ
메르시뤼탱파티세리,"카페,디저트",,영업 종료,,284,여기 밀푀유 지이이인짜 맛있어요 페스튜리는 파사사삭하고 크림은 진하고 맛있어요!,티그레+밀푀유샌드+다쿠아즈+에끌레어 1개씩 구매했는데요.,피스타치오 에끌레어가 진짜 맛있어요! 크림 색을 보면 피스타치오가 얼마나 듬뿍인지 알 수 있어요
대구형제막창 방배점,대구형제막창,,영업 중,4.54,458,좋은 숯으로 굽는 돼지막창과 닭발은 완전 존맛탱입니다. 좋은 숯으로 굽는 송이 버섯은 완전 맛돌이네요.,술이 아닌 밥으로 생각나서 가게되는 곳 진짜 맛있어요! 옛날도시락도 꼭 시키시길!,소막창 돼지막창 닭발 도시락까지 전부다 먹고 왔는데! ㅎㅎ 너무맛있어요 냄새도 없구!
탐나종합어시장 이수역점,생선회,,영업 중,,999+,이수에 맛있는 횟집 찾았어요! 회에 소주 술술들어감ㅎㅎ 불금에 완전 잘먹구갑니다 !,wow 존맛탱! 회가 정말 회같고 매운탕이 정말 매워요! 제가 이재용이라면 매일 왔을겁니다!,"회전률이 엄청나서 언제나 신선한 활어회 맛도 좋고 가격도 좋아 가족모임, 직장 회식에 아주 좋습니다"
라화방 직영7호점,중식당,,영업 중,4.45,999+,오랜만에 방문했는데 여전히 맛있는 라화방! 마라샹궈도 맛있고 꿔바로우도 여전히 바삭하고 맛있어요 :),리뷰 보고 찾아왔는데 재료도 신선하고 종류가 많아서 고르기 좋았어요! 꿔바로우도 엄청 바삭해서 맛있어용!,가성비짱좋고 맛있어요 꿔바로우도 진짜맛남! 이수역 마라탕최고맛집
파티시안,"카페,디저트",,영업 중,4.82,999+,내방역디저트 카페 맛집 파티시안입니다. 특히 여성분 100% 만족할거라 확인합니다.,내방역디저트 찐맛집 방배동 카페 파티시안! 여기여긴 정말 찐입니다. 음료도 찐 디저트는 찐찐.!,빵천국 디저트천국 방배동에서 4년 째 성업 중인 파티시안 다녀왔습니다. 음료는 꼭 오레로 시키세요
버거307 이수점,햄버거,,영업 중,4.53,561,햄버거 좋아하는 아이와 방문했어요 번이 달끈한게 부드럽고 맛있습니다.,"퀸즈파크의 퍼그버거에 기준 두고 있어서 , 평균적. 세트에 니오는 생맥주의 양이 개인적으로 적당하고 좋음.",작은 실수가 있었지만 잘 대처해주셨고 버거는 진짜 푸짐하게 잘 나오고 패티도 맛있어요 ㅎㅎ
또또즐갬성술집,요리주점,,영업 중,5,420,진심을 담은 후기입니다! 정말 당산 최고의 술집이에요! 안주를 5개정도 먹었는데 다 정말 맛있었어요!,처음 가봤는데 너무 만족했습니다! 어묵탕이랑 고기 다 맛있고 양도 많아요! 하이볼도 맛있습니다,스무살때부터 3년 내도록 가고있는 술집입니다! 안주 너무 맛있고 특히 전기바베큐통구이 진짜 맛있어요
이누식당,양식,,영업 중,4.55,999+,메뉴 다 특별하고 맛있었어요 오리 스테이크는 너무 부드럽고 처음 먹어보는 소스였는데 너무 맛있었습니다!,치즈 둠뿍 진한맛의 파스타 넘 맛있어요 크림파스타랑 오일파스타 다른 느낌이여서 같이 먹기 좋아요,내방역 파스타 맛집 이누식당에 가봤는데 레스토랑 분위기도 감성있었고 늘봄/또바기 파스타도 넘 맛있었어요!
미스사이공 이수점,베트남음식,,영업 중,4.31,999+,동네에 흔한 쌀국수 맛집ㅋ 가성비 맛있음요 ㅋ,쌀국수 3700원대부터 다닌거 같은데 세월만끔 많이 올랐네요 좋아하는 집이예요,생소해 베트남 쌀국수만 먹어 보았었는데 오늘 도전 성공. 맛있게 먹었어요.^^
타파델디아,스페인음식,,오늘 휴무,,84,신메뉴 빠에야가 나왔다고 해서 재방문했습니다.,자유롭고 열정적인 스페인 요리를 방배동에서 만나다 함께한 달달한 스페인 맥주와 와인도 넘 맛있었고요^^,"음식하나하나 진짜 다 맛있어요, 그리고 바스크 치즈케이크도 다른가게보다 훨씬 부드러워요 종종 놀러갈게요"
희희낙락,요리주점,,영업 중,,107,서비스로 감자샐러드 주셨는데 크림 와사비소스(?) 같은 게 느껴져서 특별했고 두유파스타 강추입니다!,"오랜만에 들린 희희낙락에서 맛있는 음식과 술 한잔으로 즐거운 금밤을 보냈어요! ""얼그레이 하이볼"" 강추!","소갈비살철판구이, 두유하이볼, 생맥주 하나 빼놓을 것 없이 진짜 맛도리입니다."
신용산감자탕,감자탕,,영업 중,,411,감자탕만 취급하는 감자탕 전문점이다.이수역에서 도보 5분도 않걸리고 2층에 위치에있다.양이 많은편이다.,시래기의 쓴 맛이 좀 나서 그냥 뼈해장국 추천이요. 뼈고기도 1개!,우리동네 최애 맛집이에요 :) 고기가 잡내 없이 깔끔하고 감자탕중에선 서울에서 최고라고 자부합니다 !
샘골 참숯불 막창구이,"곱창,막창,양",,영업 중,4.55,319,곁들여 먹는 법을 친절하게 설명해주셔서 친구와 맛있는 돼지막창이랑 소갈비를 먹었어요 !,지금까지 먹은 막창 중에 제일 맛있는 곳이에요,이수역최애맛집 갈비살하고 막창 된찌는 갈때마다 먹는데 n년째 먹어도 질리지 않고 한결같은 맛
이수2정육식당,정육식당,,영업 중,4.26,402,고기도 맛나고 가성비가 넘 좋아요 ! 된장찌개도 슴슴하니 솥밥이랑 잘어울려요 :),가마솥밥있는 고깃집 찾기 힘든데 좋아요. 고기도 다른 메뉴도 맛있게 먹었어요.,고기 신선하고 맛있어요 반찬도 셀프라 무제한인거 넘 조아요 ㅎㅎ
호맥 이수점,"맥주,호프",,영업 중,,349,피자같이 잘라먹을수있게 나오는 호떡이에요. 날좋을때 야장에서 먹어도 굿이에요. 2차로 추천!,호떡이 메인 메뉴라니 신기한 마음에 방문하였습니다 호떡 뿐만 아니라 다른 메뉴들도 많아요-!,호맥 첨 먹어봤는데 넘 맛있어서 다른호떡도 궁금 맥주랑 궁합이 좋아요!
제줏간 이수점,돼지고기구이,,영업 중,,664,사이드가 굉장히 저렴해요! 고기도 맛있고 좋음!,일요일 1시경 가니 한가하고 고기도 구워주시네요.,고기도 맛있고 셀프바에 있는 채소도 다양해서 좋습니다 특히 양은메밀냉국수 추천 드려요
태평아구찜&메기매운탕,"해물,생선요리",,영업 중,4.48,331,"아구찜이 맛있어요. 이번달 두번째방문입니다. 여기는 찜이 대,중,소 로 구분되어 좋아요.",오래전부터 방문한 곳이예요. 양이 많고 맛도 무난히 맛있습니다. 볶음밥도 맛있습니다,매기매운탕이 짜지않고 매기 살도 부드럽고 맛있어요. 수제비도 쫄깃해요.
송옥 방배점,"우동,소바",,영업 중,4.27,790,만두뚝배기 국물이 얼큰하고 시원해서 맛있어요.,"돈까스 말고 만두 드세요 만두, 잘먹었습니다.",메뉴도 다양하고 음식도 맛있어요. 분식 땡기면 이곳으로 와요
미하무 mi ha mu,돈가스,,영업 중,,599,튀김옷은 얇으며서 바삭하고 고기는 엄청엄청 부드러워서 배가 불러도 질리지 않고 맛있게 먹었어요,베지테리언도 먹을 수 있는 무 채 소바 채수 장국에 메밀면 넘 맛있어요!,굴카츠도 맛있고 마지막 카레까지 비벼먹음 하루가 행복해요. 공기밥도 서비스로 더 주시니 너무 좋아요.
대동집 이수점,요리주점,,영업 중,,103,대동집 보쌈 양이 엄청 푸짐하고 맛있습니다. 명이나물이나 두부까지 구성도 아주 좋아요. 또 방문할게요!,대동집은 역시 보쌈입니다 한상푸짐하게 나오는 보쌈 최고에요,보쌈집 왜감. 그냥 여기가면 보쌈 더 맛있게 먹기 가능합니다.
