가게명,요리,개업,운영상태,별점,리뷰수,리뷰1,리뷰2,리뷰3
은은,바(BAR),,영업 중,,60,분위기 좋고 친절한 사장님과 직원분의 응대 맛있는 칵테일과 하이볼로 더 즐거운 시간이였어요,친절한 사장님과 직원 덕분에 정말 힐링하고 많이 웃고가요! 칵테일은 말할 필요 없이 맛있어요!,이수역에 새로생긴 위스키바인데 처음에 혼자 방문했다가 너무 좋아서 친구까지 불러서 같이 먹었습니다.
윤초밥 이수역점,"초밥,롤",,영업 중,,662,"저는 '윤초밥 정식', '연어모듬초밥 정식'을 주문해 먹었어요!",가심비 초밥이라는 홍보문구가 딱 맞아요. 생새우초밥은 좋았는데 나머지는 가성비에요.,"가성비 좋은 초밥집 :) 특히 세트메뉴는 구성, 맛, 가격 다 좋아서 좋더라구요!"
하코야 이수역점,일본식라면,,영업 중,4.28,261,혼밥 하기도 좋을거같고 돈코츠라멘 국물이 담백 짭쪼름해서 맛있었어요 너무 행복한걸요,늘 맛있고 사장님이 친절하세요 국물이 담백하고 깊어서 돈코츠라멘은 여기서만 먹음!,매운규동(일본식 소고기덮밥)을 주문하였습니다.
제주호프,"맥주,호프",,영업 중,,42,,,
국밥장인 이수역점,국밥,,영업 중,,669,설렁탕 들기름후라이 너무 맛있어요. 애들도 너무 잘 먹네요.,지나가다 청도미나리곰탕에 끌려 들어왔어요 추가로 사태도 먹고 가성비 갑 입니다^^,한번 가봐야지하다가 오늘 왔는데 맛있네요ㅎㅎ 국밥 생각날때 또 오겠습니다
배스킨라빈스 이수역,아이스크림,,영업 중,4.42,999+,베라 아이스크림 맛있죠. 생일케익으로 최고입니다.,크리스마스를 더욱 특별하게 해주는 다양한 케잌이 기다립니다.,기라델리 쉐이크? 암튼 그거 맛있어여
라바트리 방배,카페,,영업 중,4.71,820,커피 너무너무 맛있어요! 처음 가봤는데 디카페인 원두가 오히려 더 맛있다는 리뷰가 많던데 정말이에요 ㅎ,커피가 맛있어서 자주 들리는 카페에요 크루키가 새로 나왔는데 진짜 맛있어요!,베리몬 처음먹었는데 되게 맛있네요! 저녁이라 커피가 부담스러웠는데 맛있는거 먹구가요!
이디야커피 총신대입구역점,카페,,영업 중,,774,추워서 오랜만에 이디야 방문해서 오곡라떼 따뜻하게 먹으니 옛날 생각나고 좋았어요,편안하고 친구들과 만나기 좋은곳이네요 식사하고 추운데 따뜻한 커피 한잔 좋았어요^^,이디야 버블티 첨인데 맛나네용ㅎㅎ 밀크티도 당도 적당해서 좋아요
반포정 이수점,"육류,고기요리",,영업 중,,476,입짧은 우리딸이 맛있는 고기집이라고 부르는 집입니다^^. 마늘 양념갈비살 넘 맛있구요,가격은 저렴하고 고기질은 좋고! 이수역 최고 소갈비살 맛집입니다. 단체모임 하기에도 좋을 것 같아요!,마늘 듬뿍 올라간 양념소갈비 부드럽고 맛있어요 고수무침과 함께 먹으니 환상세 궁합이구요
담소소사골순대육개장 이수역점,"순대,순댓국",,영업 중,4.29,999+,순대국 맛있어서 혼술 자주가요 친절하고좋습니다,너무 추운날 뜨끗한 순두부랑 육개장 밥한그릇 뚝딱 했네요 잘먹고 갑니다요,맛있습니다ㅋㅋㅋ 순대국중에서는 깔끔한 맛이라 좋아해요
우언트,요리주점,,영업 중,,102,파스타 맛있구! 청양 뇨끼 맛닜어용 ! 데이트하기 좋은 술집,고급스러운 안주에 주류도 다양해서 좋아요 소주와 함께 먹는 파스타 최고에요,피쉬앤누들은 갓튀긴 생선이 통통하고 잔뼈하나 없어서 먹기 간편하면서 특별한 맛이었어요!
방오돈 경양식돈가스 스낵바,돈가스,,영업 중,,43,오늘도 역시나 참! 맛있는 방오돈 돈까스 잘먹고 감니다.,우동이 싸요. 돈까스랑 2개씩 시켜사 니눠 먹으니 딱이네요,
왕금성 이수역점,중식당,,영업 중,,449,코스요리로 먹고 왔는데 구성이 너무 좋아요 맛도리라 싹싹 남김없이 먹고왔어요,이수역에서 제일 맛있는 중국 음식 레스토랑 입니다. 주차도 가능하고룸도 있어서 모임 하기도 좋습니다.,이수역중국집 왕금성 런치코스 향정식 먹고왔어요.
NEW88,베트남음식,,영업 중,,368,쌀국수먹으러 갔는데 반쎄오가 눈에띄어서 주문했어요 전이 바삭하고 채소랑 소스랑 넘환상조합!,먹느라 사진을 못 찍었어요 왕갈비쌀국수 파인애플볶음밥 반쎄오 먹었어요 근데 뚝배기쌀국수가 더 맛있나봐요,2인세트a(뚝배기 쌀국수+껌쓰언+월남쌈) 맛있게 잘먹었어요
국수나무 이수역점,국수,,영업 중,4.62,887,국수보다 돈까스가 더 맛있습니다 특히 김치찌개 돈까스는 깜짝 놀랐습니다,소스아낌없이 넣어주셔서 너무좋아요 밥이더많고 양적어서 허연 덮밥은안좋아하는데 . 맛도좋아요,"맛있는 편이며, 간간히 제육덮밥을 사먹을만한 맛입니다."
레발콩 사당이수 본점,"카페,디저트",,영업 중,,447,"핫한 디저트가 많이 있어요! 예전에 커피집이 많이 있었던 자리였는데, 본중에 제일 예쁘게 변신했네용",처음 왔는데 분위기도 예쁘고 태라스도 좋아서 기분까지 좋아져용 자주올게유! 자두에이드 추천,맥주 마시고싶은 친구와 차를 마시고싶은 친구가 모두 만족하는 곳. 테라스가 너무 이뻐요!
완미족발 서울사당점,"족발,보쌈",,영업 중,,651,족발이랑 보쌈 반반 먹었는데 따듯하니 맛이 있습니다 막국수는 없으니 참고 부탁드려요!,한상차림이 너무 푸짐해서 좋아요! 족발도 맛있어요 ㅎㅎ,족발 정말 맛있구 밑반찬들 진짜 잘어울리고 맛나요 담에도 올게용
마장동 고기집 이수역점,소고기구이,,영업 중,,274,돼지갈비는 처음 시켜봤는데 맛있어요 주류값 너무 좋아요 ^^,맛있게 잘 먹고 친구 잘 만나고 갑니다 고기가 쬐끔 타긴 했지만 고기 맛있었습니다,"사이드로 떡볶이, 콘치즈, 순두부국, 두부김치 등등 다양하게 나와서 좋아요!"
만발,소고기구이,,영업 중,4.65,225,"연잎 밥이 맛있네요. 점심특선 13,000원으로 간단히 먹기에 좋았어요.",장모님 생신이라 맛있는 고기집 찾다가 예약방문했습니다. 재방문 의사 있습니다.,음식이 정갈하다 고기도 맛있을듯
스타벅스 이수자이점,카페,,영업 중,4.47,999+,스타벅스 조각케잌이 다른 카페에 비해서 싸서 부담이 없네요.,슈크림라떼 넘 먹고싶어서 달려왔어요 ! 역시 당충전엔 슈크림라떼가 최고 >_<,딸기 딜라이트 요거트 블렌디드 벤티 god !
투썸플레이스 이수역사거리점,카페,,영업 중,,999+,스누피음료 마셔봤는데 초코바나나우유맛 달달하니 맛있었어용 위에 찰리브라운초코도 달지 않고 맛있고요.,디저트와 커피가 맛있고 분위기가 좋으며 화장실이 깨끗해요,복자요거트프라페 진짜 제 취향 . 진짜 맛있어요 ! 젤리도 씹히고 최고입니다아
싸다김밥 이수역점,분식,,영업 중,4.49,999+,돈까스마요덮밥 조금 느끼하지만 맛있고 푸짐해요!,김밥을 자주 사먹어요 크기도 크고 신선하게 맛있어요 다 맛있어요,김밥이 맛있고 가격도 착해서 너무 좋아요! 매장도 멋지고 직원분께서 너무나 친절하세요!
23번지남산돈까스 이수역점,돈가스,,영업 중,,286,반반 소스 돈까스와 원조돈까스 이렇게 시켜먹었습니다. 역시 왕돈까스라 그런지. 양이 어마무시하네요,"평소 느끼함 때문에 돈까스를 끝가지 다 먹어본 적이 없는데, 여기 돈까스 클리어 했어요 ㄷㄷ.","반반소스 돈가스 세트가 맛있고 양도 많고, 사장님과 직원들도 친절하셔서 만족스럽게 잘 먹었습니다!"
라무진 이수점,양갈비,,영업 중,4.47,478,라무진은 언제나 고기를 구워주셔서 편하게 잘 먹을 수 있어서 좋아여,바로 앞에서 구워줘요 고기질이 좋아보이네요 가격은 있지만 맛있게 잘 먹었습니다,양갈비 처음먹어봤는데 설명도 잘 해주시고 친철하게 구워주셔서 너무 편하게 잘 먹고 왔습니다.
투썸플레이스 이수역점,카페,,영업 중,4.48,999+,달디단 밤양갱 라떼 맛있어요! 양갱 좋아하시는 분들 추천! 바밤바 맛입니다.,찬절하시고 매장도 깔끔하니 분위기도 편해요 망고쥬스넘맛나맛나요^^,"커피시켜서 먹었어요. 공간도2,3층에서 마실 수 있어서 좋긴합니다. 그러나 조용한 분위기는 3층입니다."
빽다방 총신대입구역점,테이크아웃커피,,영업 중,,999+,,,
맛닭꼬 이수역점,"치킨,닭강정",,영업 중,4.36,277,튀긴 치킨이 아니고 구운 치킨이라 다이어트 할 때도 자주 와요 ㅎㅎ 맛있고 건강한 치킨?!,치킨이랑 골뱅이소면 같이 먹어 맛있어요 닭가슴살인데 퍽퍽하지 않고 튀기지 않고 구워 건강한 맛입니다,이수역치킨은 맛닭꼬 맛과 가성비 따라올자없음
이모네막국수,막국수,,영업 중,4.25,494,주차하기 편해서 자주감. 묵사발이 새콤한게 맛잇음,돼지갈비 숯불에 구워나와서 잡내하나도없고 맛있고 장칼국수도 완전맛나맛나요,갈비는 구워서 나와 좋아요. 돌판에 따듯하게 오래 먹을수 있어요
상아김밥 이수점,분식,,오늘 휴무,4.51,979,내돈내산 단골집 상아김밥 라면+주먹밥 조합은 늘 성공적,김밥이 영양이 듬뿍 들어 있어서 너무 좋습니다.,"키토김밥 처음먹어봤는데. 생각보다 맛있고, 떡볶이가 달지않아서 좋았어요"
TMB 숯불닭바베큐,"치킨,닭강정",,영업 중,4.35,372,"담백한 소금구이, 매콤한 양념구이 가족의 입맛대로 먹을 수 있어서 자주 이용해요.",동네 치킨맛집 사람도 많고 맛있어요;),오랫만에 숯불닭갈비 매콤 깔끔맛있어요 맥주가 계속 땡기는맛
소소정,갈비탕,,영업 중,4.12,250,갈비탕도 맛있지만 김치와 고추장아찌도 맛있어요.,가게가 작지만 구석구석 사장님의 손길이 느껴집니다 갈비탕맛은 무난 반찬도 맛이 무난,너무 맛있네요 고기도 신선해요 제가 탕음식은 쩐맛이 좀심하면 못먹는데 그런거 하나도 없구 담백하고 좋네요ㅎ
노모어피자 이수역점,피자,,24시간 영업,,214,늘 옥수수새우피자 먹다가 반반으로 시켜봤어요 맛있는거 아는데 기대되요^^,꼭 먹어보고 싶었는데. 드디어 오늘. 늦은 시간까지 피자를 살 수 있다는. 너무 맛있어요.,뇨끼가 오븐스파게티처럼나오는지는 몰랐음. 맛은 좀 심심했는데 파마산치즈 잔뜩 뿌렸더니 좋더라고요 ㅋㅋ
포몬스 방배점,베트남음식,,영업 중,4.29,999+,방배동쌀국수맛집 거즘20년단골인거같아요 생각날때꼭오구 배달도자주먹어요:) 날추워지니바로 ㄱㄱ 이게s입니당,늘 무난하게 가기 좋은 곳. 주차도 되고 영업시간도 길다. 그러면서도 쌀국수 국물은 어느 곳보다 맛있다.,부담없이 가서 즐기기 좋은 오랜 방배동 쌀국수 맛집이에요.
새퍼커피,카페,,영업 중,4.84,440,커피 가격 넘 착하고 사장님 넘나 친절하시고 일단 커피맛이 넘 좋아요 자주 올거에요,진하고 고소한 라떼가 찐이네요! 무언가 커피 고수의 향이 느껴집니다!,"바닐라라떼랑 커피 ,바스크치즈케이크 모두 맛있어요! 동네에 이런 카페가 있어서 너무 좋아요"
딴짓제과점,베이커리,,오늘 휴무,,266,딴짓 샌드위치 짱짱 맛있어요.! 쫀득퐁신 치아바타 좋아하시면 진짜 맛있게 드실 거예요.,빵 종류도 다양하고 가격도 착해요 소금빵 맛있어요,"헤이즐넛 초코크로와상, 콘치즈소세지 크로와상, 바게트, 밤식빵 다 맛있어용"
맘스터치 이수점,햄버거,,영업 중,4.34,999+,,,
귀한족발 이수역점,"족발,보쌈",,영업 중,,560,보쌈이랑 족발 다 먹고싶었는데 보족 세트가 있어 좋았어요!,족발이랑 코다리막국수 너무 맛있게 먹었어요! 양도 푸짐하고 직원분들도 친절하셔서 식사 편안하게 했습니다,족발 땡겨서 남자친구랑 갔는데 넘 맛있게 먹고왔어용 막국수도 너무너무 맛있어용 다음에 또 올게요
고창풍천장어 이수역점,"장어,먹장어요리",,영업 중,5,87,장어가 넘 먹고싶어서 찾아보다 갔는데 너무너무 만족스러웠습니다 재방문의사 100%!,리뷰 보니까 사장님 바뀌었다고 해서 가족이랑 장어 먹으러 왔습니다 부모님이 굉장히 좋아하셨어요 !,간만에 장어 먹고싶어서 갔는데 장어 자체도 깔끔하게 맛있고 양도 넉넉해서 장어만 먹고도 배부르게 먹었어요!
메가MGC커피 이수역점,카페,,영업 중,,999+,달달한 요거트맛도 잘 느껴져요 매장안 도 넓고 안쪽에 좌석수도 많습니다 위치도 이수역 바로앞에 있습니다,음료도 맛나구용 커피도 맛나구용 빵도 맛나구용 사람도 많아용ㅎ 요구사항도 잘 들어주시네용ㅎ,감자빵이랑 밀크티에 펄 추가해서 먹었어요. 밀크티 펄 추가는 아이스 메뉴에만 되더라고요.
노스티모,그리스음식,,오늘 휴무,4.77,917,수블라키랑 그릭샐러드! 고기 빵 야채 곁들여 먹으니 맛있어요 ㅋㅋ 소스가 넘 맛있더라구용,내방역 맛집 노스티모 특별한 음식 특별한 메뉴 있어요 그리스 음식점이라 지중해식단 속도 편하고 신선해요,"어린이날 기념으로 아이들과 방문하였는데, 그리스음식 건강하게 맛있는 맛이예요 다음에 또 갈께요 :)"
놀부한방족발,"족발,보쌈",,영업 중,4.27,999+,남성시장 갔다가 구매해봤는데 족발이 너무 맛있었어요 다음에 시장가면 신랑이랑 또 사먹기로했네요,이번에 불족발이랑 막국수가 새로 나왔다고 하시길래 시켜봤어요,족발 생각나면 꼭 이집으로 족발 먹으러와요! 족발 찐 맛집 다음에는 포장하러 올게요
영풍치킨 사당본점,"치킨,닭강정",,영업 중,4.14,854,"옛날 치킨 스타일이고, 미리 초벌을 해둬서 빠르게 서빙됩니다. 도란도란 맥주마시며 대화 나누기 좋아요.",가성비 최고 횟집이네요. 랍스타도 나옵니다 ^^,축구 한일전이라 경기시작 30분전에 왓는데 겨우 한자리 비엇더라구요ㅎㅎ 치킨은 후라이드가 더 맛있어요
